A2: 年份 | B2: 工作收入 | C2: 投资收入 | D2: 消费支出 | E2: 教育支出 | F2: 保险支出 | G2: 医疗支出 | H2: 旅游支出 | I2: 还贷支出 | J2: 投资支出 | K2: 总收入 | L2: 总支出 | M2: 总结余
A3: 第1年 | B3: 180000 | C3: 20274 | D3: 24000 | E3: 5000 | F3: 7911 | G3: 1000 | H3: 12000 | I3: 0 | J3: 131089 | K3: =B3+C3 -> 200274 | L3: =SUM(D3:J3) -> 181000 | M3: =K3-L3 -> 19274
A4: 第2年 | B4: 249600 | C4: 22789 | D4: 49680 | E4: 5000 | F4: 15081 | G4: 1000 | H4: 12000 | I4: 140413 | J4: 27426 | K4: =B4+C4 -> 272389 | L4: =SUM(D4:J4) -> 250600 | M4: =K4-L4 -> 21789
A5: 第3年 | B5: 259584 | C5: 26011 | D5: 51420 | E5: 5000 | F5: 15609 | G5: 1000 | H5: 12000 | I5: 140413 | J5: 35142 | K5: =B5+C5 -> 285595 | L5: =SUM(D5:J5) -> 260584 | M5: =K5-L5 -> 25011
A6: 第4年 | B6: 269967 | C6: 285144 | D6: 60000 | E6: 5000 | F6: 19260 | G6: 2000 | H6: 18000 | I6: 140413 | J6: 27294 | K6: =B6+C6 -> 555111 | L6: =SUM(D6:J6) -> 271967 | M6: =K6-L6 -> 283144
A7: 第5年 | B7: 280766 | C7: 31753 | D7: 62100 | E7: 5000 | F7: 19934 | G7: 2000 | H7: 18000 | I7: 140413 | J7: 35319 | K7: =B7+C7 -> 312519 | L7: =SUM(D7:J7) -> 282766 | M7: =K7-L7 -> 29753
A8: 第6年 | B8: 291997 | C8: 35758 | D8: 64274 | E8: 5000 | F8: 20632 | G8: 2000 | H8: 18000 | I8: 140413 | J8: 43678 | K8: =B8+C8 -> 327755 | L8: =SUM(D8:J8) -> 293997 | M8: =K8-L8 -> 33758
A9: 第7年 | B9: 303677 | C9: 39645 | D9: 66523 | E9: 15000 | F9: 21354 | G9: 4000 | H9: 18000 | I9: 140413 | J9: 42387 | K9: =B9+C9 -> 343322 | L9: =SUM(D9:J9) -> 307677 | M9: =K9-L9 -> 35645
A10: 第8年 | B10: 315824 | C10: 44364 | D10: 68851 | E10: 15000 | F10: 22101 | G10: 4000 | H10: 18000 | I10: 140413 | J10: 51458 | K10: =B10+C10 -> 360188 | L10: =SUM(D10:J10) -> 319823 | M10: =K10-L10 -> 40365
A11: 第9年 | B11: 328457 | C11: 49949 | D11: 71261 | E11: 15000 | F11: 22875 | G11: 4000 | H11: 18000 | I11: 140413 | J11: 60908 | K11: =B11+C11 -> 378406 | L11: =SUM(D11:J11) -> 332457 | M11: =K11-L11 -> 45949
A12: 第10年 | B12: 341595 | C12: 56317 | D12: 73755 | E12: 16310 | F12: 23675 | G12: 4000 | H12: 18000 | I12: 140413 | J12: 69441 | K12: =B12+C12 -> 397912 | L12: =SUM(D12:J12) -> 345594 | M12: =K12-L12 -> 52318
A13: 第11年 | B13: 355259 | C13: 63625 | D13: 76337 | E13: 16310 | F13: 24504 | G13: 4000 | H13: 18000 | I13: 140413 | J13: 79695 | K13: =B13+C13 -> 418884 | L13: =SUM(D13:J13) -> 359259 | M13: =K13-L13 -> 59625
A14: 第12年 | B14: 362364 | C14: 71261 | D14: 79009 | E14: 16310 | F14: 25362 | G14: 4000 | H14: 18000 | I14: 140413 | J14: 83271 | K14: =B14+C14 -> 433625 | L14: =SUM(D14:J14) -> 366365 | M14: =K14-L14 -> 67260
A15: 第13年 | B15: 369611 | C15: 79226 | D15: 81774 | E15: 16310 | F15: 26249 | G15: 4000 | H15: 18000 | I15: 140413 | J15: 86865 | K15: =B15+C15 -> 448837 | L15: =SUM(D15:J15) -> 373611 | M15: =K15-L15 -> 75226
A16: 第14年 | B16: 377003 | C16: 87523 | D16: 84636 | E16: 16310 | F16: 27168 | G16: 4000 | H16: 18000 | I16: 140413 | J16: 90476 | K16: =B16+C16 -> 464526 | L16: =SUM(D16:J16) -> 381003 | M16: =K16-L16 -> 83523
A17: 第15年 | B17: 384543 | C17: 96152 | D17: 87598 | E17: 16310 | F17: 28119 | G17: 4000 | H17: 18000 | I17: 140413 | J17: 94103 | K17: =B17+C17 -> 480695 | L17: =SUM(D17:J17) -> 388543 | M17: =K17-L17 -> 92152
A18: 第16年 | B18: 392234 | C18: 105007 | D18: 90664 | E18: 17485 | F18: 29103 | G18: 4000 | H18: 18000 | I18: 140413 | J18: 96569 | K18: =B18+C18 -> 497241 | L18: =SUM(D18:J18) -> 396234 | M18: =K18-L18 -> 101007
A19: 第17年 | B19: 400079 | C19: 127074 | D19: 93837 | E19: 17485 | F19: 30122 | G19: 6000 | H19: 18000 | J19: 240635 | K19: =B19+C19 -> 527153 | L19: =SUM(D19:J19) -> 406079 | M19: =K19-L19 -> 121074
A20: 第18年 | B20: 408080 | C20: 149476 | D20: 97122 | E20: 17485 | F20: 31176 | G20: 6000 | H20: 18000 | J20: 244298 | K20: =B20+C20 -> 557556 | L20: =SUM(D20:J20) -> 414081 | M20: =K20-L20 -> 143475
A21: 第19年 | B21: 416242 | C21: 172904 | D21: 100521 | E21: 9970 | F21: 32267 | G21: 6000 | H21: 18000 | J21: 255484 | K21: =B21+C21 -> 589146 | L21: =SUM(D21:J21) -> 422242 | M21: =K21-L21 -> 166904
A22: 第20年 | B22: 424567 | C22: 196669 | D22: 104039 | E22: 9970 | F22: 33397 | G22: 6000 | H22: 18000 | J22: 259161 | K22: =B22+C22 -> 621236 | L22: =SUM(D22:J22) -> 430567 | M22: =K22-L22 -> 190669
A23: 第21年 | B23: 433058 | C23: 220771 | D23: 107681 | E23: 9970 | F23: 34565 | G23: 6000 | H23: 18000 | J23: 262842 | K23: =B23+C23 -> 653829 | L23: =SUM(D23:J23) -> 439058 | M23: =K23-L23 -> 214771
A24: 第22年 | B24: 441719 | C24: 243348 | D24: 111449 | E24: 30290 | F24: 35775 | G24: 6000 | H24: 18000 | J24: 246205 | K24: =B24+C24 -> 685067 | L24: =SUM(D24:J24) -> 447719 | M24: =K24-L24 -> 237348
A25: 第23年 | B25: 450554 | C25: 266263 | D25: 115350 | E25: 30290 | F25: 37027 | G25: 6000 | H25: 18000 | J25: 249886 | K25: =B25+C25 -> 716817 | L25: =SUM(D25:J25) -> 456553 | M25: =K25-L25 -> 260264
A26: 第24年 | B26: 459565 | C26: 289515 | D26: 119387 | E26: 30290 | F26: 38323 | G26: 6000 | H26: 18000 | J26: 253564 | K26: =B26+C26 -> 749080 | L26: =SUM(D26:J26) -> 465564 | M26: =K26-L26 -> 283516
A27: 第25年 | B27: 468756 | C27: 313103 | D27: 123566 | E27: 30290 | F27: 39664 | G27: 6000 | H27: 18000 | J27: 257236 | K27: =B27+C27 -> 781859 | L27: =SUM(D27:J27) -> 474756 | M27: =K27-L27 -> 307103
A28: 第26年 | B28: 478131 | C28: 325592 | D28: 127891 | E28: 155000 | F28: 41053 | G28: 6000 | H28: 18000 | J28: 136188 | K28: =B28+C28 -> 803723 | L28: =SUM(D28:J28) -> 484132 | M28: =K28-L28 -> 319591
A29: 第27年
A30: 第28年
A31: 第29年
A32: 第30年

A1: 年份 | B1: 金融资产 | C1: 保险资产 | D1: 房产 | E1: 汽车 | F1: 其他资产 | G1: 房贷 | H1: 车贷 | I1: 其他贷款 | J1: 总资产 | K1: 总负债 | L1: 净资产
A2: 第1年 | B2: 457471 | C2: 0 | D2: 1000000 | E2: 100000 | F2: 5000 | G2: 600000 | H2: 0 | I2: 0 | J2: =SUM(B2:F2) -> 1562471 | K2: =SUM(G2:I2) -> 600000 | L2: =J2-K2 -> 962471
A3: 第2年 | B3: 487412 | C3: 100000 | D3: =D2*1.1 -> 1100000 | E3: =E2-5000 -> 95000 | F3: 5000 | G3: =G2-90000 -> 510000 | H3: 0 | I3: 0 | J3: =SUM(B3:F3) -> 1787412 | K3: =SUM(G3:I3) -> 510000 | L3: =J3-K3 -> 1277412
A4: 第3年 | B4: 525776 | C4: 100000 | D4: =D3*1.1 -> 1210000 | E4: =E3-5000 -> 90000 | F4: 100000 | G4: =G3-90000 -> 420000 | H4: 0 | I4: 0 | J4: =SUM(B4:F4) -> 2025776 | K4: =SUM(G4:I4) -> 420000 | L4: =J4-K4 -> 1605776
A5: 第4年 | B5: 555574 | C5: 100000 | D5: =D4*1.1 -> 1331000 | E5: =E4-5000 -> 85000 | F5: =F4+5000 -> 105000 | G5: =G4-90000 -> 330000 | H5: 0 | I5: 0 | J5: =SUM(B5:F5) -> 2176574 | K5: =SUM(G5:I5) -> 330000 | L5: =J5-K5 -> 1846574
A6: 第5年 | B6: 594131 | C6: 200000 | D6: =D5*1.1 -> 1464100 | E6: =E5-5000 -> 80000 | F6: =F5+5000 -> 110000 | G6: =G5-90000 -> 240000 | H6: 0 | I6: 0 | J6: =SUM(B6:F6) -> 2448231 | K6: =SUM(G6:I6) -> 240000 | L6: =J6-K6 -> 2208231
A7: 第6年 | B7: 641815 | C7: 200000 | D7: =D6*1.1 -> 1610510 | E7: =E6-5000 -> 75000 | F7: =F6+5000 -> 115000 | G7: =G6-90000 -> 150000 | H7: 0 | I7: 0 | J7: =SUM(B7:F7) -> 2642325 | K7: =SUM(G7:I7) -> 150000 | L7: =J7-K7 -> 2492325
A8: 第7年 | B8: 688088 | C8: 200000 | D8: =D7*1.1 -> 1771561 | E8: =E7-5000 -> 70000 | F8: =F7+5000 -> 120000 | G8: =G7-90000 -> 60000 | H8: 0 | I8: 0 | J8: =SUM(B8:F8) -> 2849649 | K8: =SUM(G8:I8) -> 60000 | L8: =J8-K8 -> 2789649
A9: 第8年 | B9: 744265 | C9: 200000 | D9: =D8*1.1 -> 1948717.1 | E9: =E8-5000 -> 65000 | F9: =F8+5000 -> 125000 | H9: 0 | I9: 0 | J9: =SUM(B9:F9) -> 3082982.1 | K9: =SUM(G9:I9) -> 0 | L9: =J9-K9 -> 3082982.1
A10: 第9年 | B10: 810758 | C10: 200000 | D10: =D9*1.1 -> 2143588.81 | E10: =E9-5000 -> 60000 | F10: =F9+5000 -> 130000 | H10: 0 | I10: 0 | J10: =SUM(B10:F10) -> 3344346.81 | K10: =SUM(G10:I10) -> 0 | L10: =J10-K10 -> 3344346.81
A11: 第10年 | B11: 886567 | C11: 350000 | D11: =D10*1.1 -> 2357947.691000002 | E11: =E10-5000 -> 55000 | F11: =F10+5000 -> 135000 | H11: 0 | I11: 0 | J11: =SUM(B11:F11) -> 3784514.691000002 | K11: =SUM(G11:I11) -> 0 | L11: =J11-K11 -> 3784514.691000002
A12: 第11年 | B12: 973569 | C12: 350000 | D12: =D11*1.1 -> 2593742.4601000026 | E12: 180000 | F12: =F11+5000 -> 140000 | H12: 0 | I12: 0 | J12: =SUM(B12:F12) -> 4237311.4601000026 | K12: =SUM(G12:I12) -> 0 | L12: =J12-K12 -> 4237311.4601000026
A13: 第12年 | B13: 1064476 | C13: 350000 | D13: =D12*1.1 -> 2853116.7061100029 | E13: =E12-7000 -> 173000 | F13: =F12+5000 -> 145000 | H13: 0 | I13: 0 | J13: =SUM(B13:F13) -> 4585592.7061100025 | K13: =SUM(G13:I13) -> 0 | L13: =J13-K13 -> 4585592.7061100025
A14: 第13年 | B14: 1159306 | C14: 350000 | D14: =D13*1.1 -> 3138428.3767210036 | E14: =E13-7000 -> 166000 | F14: =F13+5000 -> 150000 | H14: 0 | I14: 0 | J14: =SUM(B14:F14) -> 4963734.376721004 | K14: =SUM(G14:I14) -> 0 | L14: =J14-K14 -> 4963734.376721004
A15: 第14年 | B15: 1258079 | C15: 350000 | D15: =D14*1.1 -> 3452271.214393104 | E15: =E14-7000 -> 159000 | F15: =F14+5000 -> 155000 | H15: 0 | I15: 0 | J15: =SUM(B15:F15) -> 5374350.2143931035 | K15: =SUM(G15:I15) -> 0 | L15: =J15-K15 -> 5374350.2143931035
A16: 第15年 | B16: 1360812 | C16: 350000 | D16: =D15*1.1 -> 3797498.3358324147 | E16: =E15-7000 -> 152000 | F16: =F15+5000 -> 160000 | H16: 0 | I16: 0 | J16: =SUM(B16:F16) -> 5820310.3358324151 | K16: =SUM(G16:I16) -> 0 | L16: =J16-K16 -> 5820310.3358324151
A17: 第16年 | B17: 1466236 | C17: 350000 | D17: =D16*1.1 -> 4177248.1694156565 | E17: =E16-7000 -> 145000 | F17: =F16+5000 -> 165000 | H17: 0 | I17: 0 | J17: =SUM(B17:F17) -> 6303484.1694156565 | K17: =SUM(G17:I17) -> 0 | L17: =J17-K17 -> 6303484.1694156565
A18: 第17年 | B18: 1728937 | C18: 350000 | D18: =D17*1.1 -> 4594972.9863572223 | E18: =E17-7000 -> 138000 | F18: =F17+5000 -> 170000 | H18: 0 | I18: 0 | J18: =SUM(B18:F18) -> 6981909.9863572223 | K18: =SUM(G18:I18) -> 0 | L18: =J18-K18 -> 6981909.9863572223
A19: 第18年 | B19: 1995637 | C19: 350000 | D19: =D18*1.1 -> 5054470.2849929454 | E19: =E18-7000 -> 131000 | F19: =F18+5000 -> 175000 | H19: 0 | I19: 0 | J19: =SUM(B19:F19) -> 7706107.2849929454 | K19: =SUM(G19:I19) -> 0 | L19: =J19-K19 -> 7706107.2849929454
A20: 第19年 | B20: 2274549 | C20: 350000 | D20: =D19*1.1 -> 5559917.3134922404 | E20: =E19-7000 -> 124000 | F20: =F19+5000 -> 180000 | H20: 0 | I20: 0 | J20: =SUM(B20:F20) -> 8488466.3134922404 | K20: =SUM(G20:I20) -> 0 | L20: =J20-K20 -> 8488466.3134922404
A21: 第20年 | B21: 2557475 | C21: 350000 | D21: =D20*1.1 -> 6115909.0448414646 | E21: =E20-7000 -> 117000 | F21: =F20+5000 -> 185000 | H21: 0 | I21: 0 | J21: =SUM(B21:F21) -> 9325384.0448414646 | K21: =SUM(G21:I21) -> 0 | L21: =J21-K21 -> 9325384.0448414646
A22: 第21年 | B22: 2859420 | C22: 350000 | D22: =D21*1.1 -> 6727499.9493256118 | E22: =E21-7000 -> 110000 | F22: =F21+5000 -> 190000 | H22: 0 | I22: 0 | J22: =SUM(B22:F22) -> 10236919.949325612 | K22: =SUM(G22:I22) -> 0 | L22: =J22-K22 -> 10236919.949325612
A23: 第22年 | B23: 3113202 | C23: 350000 | D23: =D22*1.1 -> 7400249.9442581739 | E23: =E22-7000 -> 103000 | F23: =F22+5000 -> 195000 | H23: 0 | I23: 0 | J23: =SUM(B23:F23) -> 11161451.944258174 | K23: =SUM(G23:I23) -> 0 | L23: =J23-K23 -> 11161451.944258174
A24: 第23年 | B24: 3386003 | C24: 350000 | D24: =D23*1.1 -> 8140274.9386839923 | E24: =E23-7000 -> 96000 | F24: =F23+5000 -> 200000 | H24: 0 | I24: 0 | J24: =SUM(B24:F24) -> 12172277.938683992 | K24: =SUM(G24:I24) -> 0 | L24: =J24-K24 -> 12172277.938683992
A25: 第24年 | B25: 3662819 | C25: 350000 | D25: =D24*1.1 -> 8954302.4325523917 | E25: =E24-7000 -> 89000 | F25: =F24+5000 -> 205000 | H25: 0 | I25: 0 | J25: =SUM(B25:F25) -> 13261121.432552392 | K25: =SUM(G25:I25) -> 0 | L25: =J25-K25 -> 13261121.432552392
A26: 第25年 | B26: 3958643 | C26: 350000 | D26: =D25*1.1 -> 9849732.6758076325 | E26: =E25-7000 -> 82000 | F26: =F25+5000 -> 210000 | H26: 0 | I26: 0 | J26: =SUM(B26:F26) -> 14450375.675807633 | K26: =SUM(G26:I26) -> 0 | L26: =J26-K26 -> 14450375.675807633
A27: 第26年 | B27: 4092319 | C27: 350000 | D27: =D26*1.1 -> 10834705.943388397 | E27: =E26-7000 -> 75000 | F27: =F26+5000 -> 215000 | H27: 0 | I27: 0 | J27: =SUM(B27:F27) -> 15567024.943388397 | K27: =SUM(G27:I27) -> 0 | L27: =J27-K27 -> 15567024.943388397
A28: 第27年
A29: 第28年
A30: 第29年
A31: 第30年